id,Character,Lines
S10e3,JEFF:,"No, I'm not done drawing! (doorbell rings) Hey, Peter. Geez, Quagmire, you look terrible. Oh, I didn't get any sleep. Hi, Glenn. How are you? Not great, Lois. I'm stuck in the middle of some bad stuff with my sister. I know, it sounded like there was quite a ruckus going on over there last night. That Jeff seems like kind of a monster. Yeah, that guy's scary as an Iraq Lobster. (playing ""Rock Lobster"")  Death to America   And butter sauce   Don't boil me   I'm still alive   Iraq Lobster   Iraq Lobster.  I've tried talking to Brenda about leaving him, but I haven't gotten anywhere. I was actually hoping you could talk to her, Lois. She might open up more to you, you know, 'cause you're a woman. - Me? - Yeah, would you mind at least trying? Well, I guess she does need someone to talk to. Well, let's hope she's good at talking 'cause we know she doesn't listen so good. That we know. You know, Brenda, I'm glad we could get together. Me, too, Lois. It's nice to have a girlfriend to chat with. Don't you have any back home? Oh, no. Jeff would never allow that. You know, that's kind of what I want to talk to you about, Brenda. Do you mind taking off your sunglasses? Oh, my God. No, i-it's really not that bad. It only hurts when I see. You know, you don't have to stay with a man who treats you that way. Oh, Jeff's sweet. You don't see how soft and gentle he hits me when we're alone. Do you hear yourself? He shouldn't be hitting you at all. I don't think you understand how serious a matter Close your menu. What? Close your menu, so they know we're ready to order. I'll give you another moment. Damn it. I'm sorry. Oh, shoot. See, this is why Jeff corrects me all the time. Corrects you? Brenda, he's not correcting you, he's beating you! Well, I-I-I can see why you'd think that 'cause of the punches and all, but it's just that Jeff's been so angry about immigrants. What?! It'll be better when he gets back to work. Our relationship is just complicated, that's all. No, Brenda, it's not complicated. Trying to get a straight answer out of a 23-year-old girl is complicated. So, do you want to go out some time? Out like, go out or hang out or just do something? Like a date. Like a date date? Or like a date? Both, I I guess. Yeah, sure, maybe. I don't know. Yes, no. Here's the first three digits of my phone number. E-mail me. Joe, the guy's a menace. They've been with me three days now, and all he does is beat her day and night. And on top of that, they say they don't need to be entertained, but then they're always like, ""Hey, so what're we doing? What's next?"" Hey, Joe, can't you can't you just arrest the guy? I can't arrest Jeff unless Brenda files a formal complaint with the police. She won't go to the police. She's afraid of what Jeff will do. And to be honest, I don't blame her. I mean, w-w-what happens if one of these nights, he hits her so hard he kills her? Sorry, Quagmire. Police policy, we can't step in until it's too late. But if I were you, I'd set up an intervention. What's that? It's like a surprise birthday party, but instead of cake and presents, there's angry letters and someone who inappropriately tries to make it about themselves. Aw, that sounds great! I bet I would really shine at one of those. All right, well, first we want to thank you all for being here for Brenda. Now, I know it's going to be a long day, but we're all here because we care about her very much. What the what's going on? What's all this? Brenda, this is an intervention. A lot of us don't like how Jeff's been treating you. So we're going to say a few things, and then you'll say a few things, and then we'll be done. Sound good? Um I guess. All right, so we're going to go around the room and tell you exactly how your situation has affected each of us. Meg? I feel like if he likes you, maybe you can change him. Okay, maybe she wasn't the one to start with. Caleb? Caleb, you want to go ahead? M M me? Yeah, go ahead. Uh It's Chris. Y-You don't know my name? All right, this isn't off to a flying start. Peter, why don't you go ahead? So, you like getting beaten, huh? Well, why don't you smoke a whole carton of cigarettes! Look, I know what you guys are trying to do, but Jeff and I are fine. No, Brenda, you're not fine, okay? Please, I'd like to say something, if I may. (clearing throat) ""Brenda, the fact that you are being abused ""has affected my life in the following ways: ""The sister that I knew and loved growing up ""no longer exists. ""The person I see before me now is just a punching bag. ""And I call you 'person' and not 'woman' ""because a woman is a strong, beautiful, vibrant creature. ""A woman embraces life. ""A woman makes choices to make her life better. ""Sadly, the fact that you are with Jeff, proves to me that you have made a choice to make your life worse."" I-I want the girl I grew up with back. I want I want my sister back. Brenda, I love you. Please make the right decision. Which is a perfect time for me to tell my jokes. Peter! And I will save them for the end. Glenn, I am so lucky to have such a wonderful, loving brother like you. So, are you gonna leave him? Oh, there you are! Hey, give me some money! I saw a cool bandana. What the hell's going on here?! Listen here, you bully! For your information, Brenda just agreed to leave you! Like hell she did. Brenda, you tell 'em? No, not yet. Everyone I have wonderful news. Jeff and I are getting married. (all gasp) I'd show you the ring, but it's under the splint. My finger fell down the stairs. You're getting married?! Yeah, but only 'cause she's pregnant. Pregnant?! Oh, congratulations! Have you thought of any names yet? Maybe maybe ""Slappy""? Or-or ""Bruisey""? Or ""Keep-It-Down- In-There-sy""? Guys, what the hell am I gonna do? She can't marry that bastard. He's just gonna keep beatin' her, and then he's gonna beat the kid, too! God, I wish she'd never met Jeffrey Fecalman. You know, I was thinking Wait, what? What? That's his name? Yeah. Huh-larious. But you know, I was thinking this afternoon, what the hell happened to the days when a guy does something like that to a girl, and a bunch of us guys get together and just go kick his (bleep) ass? Boy, that'd be satisfying. Well why not? What do you mean? The three of us. We go over there and we do what's right; we kill the bastard. Whoa, whoa, Quagmire. You know, I could arrest you just for saying that. You know what else you can get arrested for? Soliciting a rooster. I don't know what this cock-a-doodle-doo thing is, but it sounds gay and it sounds scatological. I'm in. You're about to have a neat day. Quagmire, you're talking about murdering a guy. It doesn't matter what he's done, it's still murder. No, Joe, it does matter what he's done! These kinds of guys don't change. Y-you think they ever suddenly wake up and realize the error of their ways and clean up their act? No! They just keep ruining everyone's lives, and the world is better off without 'em. It's against the law, Quagmire, and that's the end of it. (loud slap, Brenda screams)"
S10e3,JEFF:,"What the hell?! Did you change the channel while I was going to get a beer?! Oh, yeah, I-I'm sorry, honey, I just wanted to see who was on Letterman. We're watching Leno, you bitch! I'm so sorry! His soft, gentle humor connects effortlessly with my mainstream sensibilities! (slaps) (screams) Let's waste this dick. Boy, everything's different now than it used to be, isn't it? You know, this morning I had a bowl of Fruity Pebbles cereal. Yeah, yeah. When I was a kid, they were boulders! (laughs loudly) (laughs) Cereals do change. Oh, no, no. Here's something, here's something. Did you hear about this? Here's a bunch of words in a row: because the economy's so bad, they've decided they're gonna shut down all the prisons. Yeah, yeah. And-and they're gonna send all the inmates to Congress. I don't get that one! Hi, there, Jeff. Hey, what's going on, dudes? Brenda just fell. Get your lazy ass up and get my neighbors some beers! Actually, we don't have time, Jeff. We were just about to go on our annual midnight hunting trip. We thought you might want to join us. Yeah, what the hell. Go shoot some animals, that sounds like fun. Hey, it beats sitting at home watching Meg pop her zits. (squish) Okay, okay, who would you rather do? Dame Judi Dench with 30 minutes of kissing first or Eddie Izzard in drag, but he has a working vagina? Would Eddie Izzard tell others about it? Eddie Izzard is very discreet. Then that's your answer. You know, Quagmire, I gotta say, I was pretty surprised you wanted me to come along. I thought you hated my guts. (chuckles) Oh, come on, Jeff, I don't hate your (bleep) guts. Well, then what the hell are we doing out here? I thought we were gonna kill Ah! So, Jeff, do you like loud sentences?! I guess. I gotta take a whiz. All right, look, when he comes back, I'm just gonna do it, okay? I'm just gonna point my gun straight at his head before he even knows what's going on. (shotgun racks) Kinda like this? You know, Quagmire, you are pathetic. You have to bring your friends out here with you to do your dirty work? What what do you mean, Jeff? You're gonna kill me, is that it? Uh-uh! Not unless you want your friend's brains all over the place! Listen, Jeff, just put the gun down and we'll forget this whole thing, okay? Oh. Well, that's never happened before. Kinda don't know what to do next. So now you'll forget the whole thing? Yeah, I, uh, guess that is what I said. No, no, we can't forget the whole thing! Yeah, you know, he's right. We can't forget it. Fine. Now here's the plan: I'm taking Quagmire for a little ride, and you guys are gonna stay out here and freeze to death! Now, get those hands where I can see 'em! All the way up! Oh, my shirt's a little too short. That's okay. You can keep 'em the way you had 'em so it covers your stomach. Thank you. You know, if this Jeff was around more, we wouldn't have tried to kill you. See you later, schmucks! All right, this is far enough. Well, Quagmire, sorry it had to end this way; a tragic hunting accident. I guess that little baby's gonna grow up without an uncle. Actually, I have a brother. Gary Quagmire. Oh. I think I think you got a brother, too, don't you? All right, forget the uncle thing! Get ready to die, Quagmire. You know, if you had any balls, you'd put that gun down and we could settle this like men. (laughs) That's awful big talk for a scrawny bastard like you. Hey, I'm serious, man. Unless you're scared I can take you. Suit yourself, man. Just means you're gonna die slower. (spits) (bones crack) (gasping) (groans) (engine starts) (engine revs) What the hell?! I killed you! I choke myself every day, you bastard! (tires squeal) (radiator hissing) (sobbing) Oh, oh, Glenn, there you are. Jeff didn't come home last night and he hasn't called. Uh, well, actually, about that, Brenda, he must've left early this morning. Yeah, we found this note he left you. ""Dear Brenda, I have decided to leave you. ""I realized that you are too good for me, ""and you and our unborn child would be better off ""without me in the picture. Love, Jeff. ""P.S. If the cops ask, tell them ""that Joe, Peter and Quagmire were with you last night. ""If you tell anyone otherwise, ""I will come back and not only hit you, but I will murder you. ""And no one will care because you're garbage. And your baby is going to be a child of garbage."" (hushed): It's a little rough, Peter. I didn't write it. Joe did. I wanted it to sound real. It's gotta sound like he wrote it. Plus, she kinda is garbage, Quagmire. ""Well, I best be rolling on now."" (hushed): Oh, come on! Who says that?! (hushed): It's an expression. Yeah, if you're in a wheelchair. Listen, you had your chance. I e-mailed it to both of you. You wrote back: ""Looks fine."" And you just added that part about Grape Ape. ""P.P.S. I really love Grape Ape. The end."" (sighs) Wow. I guess he's really gone. (sobbing) I kinda want to kill somebody else now. Ooh, Mort!"
S10e4,ACCENT:,"We now return to popular Russian cartoon, Shoe and Shoelace. Shoe and Shoelace! One is meaningless without the other! Well, that's it. I have nchoice. I've got to run away. Guess I'm on my own now, Rupert. It could be worse, though. At least I'm not getting stabbed by some random guy on the street. See? It's the exact opposite. Oh! It happened anyway! Hey, Stewie, you up? What the Brian, I've decided to run away. Don't come looking for me. And definitely don't chase me to the airport and catch me at the gate just before I'm about to get on the plane with, like, an emotional speech and possibly flowers. For example, it would be awful if all the TSA people were gathered around, watching this emotional moment, even the older black female carry-on scanner who initially stopped you at the baggage check, but who after you told her of your intentions, said, ""Go get him, child,"" in flagrant disregard of all newly-implemented post-9-11 security measures. And if you were considerin bringing a boom box to play music, I would suggest any one of these six songs. So again, ran away. Don't come after me.  I want to thank you  Dirty whores, all of you. Oh, hey, Peter. Lois, we got a problem. I think Ryan Reynolds is in love with me. What? Don't be ridiculous. It's true. Last night we were at this restaurant, and he tried to gay kiss me. I'm telling you, he wants to get with me. Peter, come on. Why would any man dress well, groom himself and lift weights just to sleep with other men? He's not gay. Well, I don't care what you say. He likes me. And we do have chemistry, I- I won't deny that. I- I I will take responsibility fomy part in this. I'm just gonna go over there and let him down easy. Oh, Snooki died. Last stop. What? This isn't the airport. Oh, my God, Rupert! We've got to get out of here! Aah! Damn it! Oh, no, no. Baby fall down! Is that? Is that Consuela? Baby all alone in street. I take baby home. It's me. Stewie. Don't you remember? You used to clean for us. We used to make you use the bathroom at the gas station. Hey, you! Uh, hey, Ryan. Uh, bad time? Um, perfect time. Come on in. I was just oiling my legs. So, hey, what's on for tonight? You know, my dentist leaves his office unlocked. I was thinking we could do some nitrous and then have dinner in there. Look, Ryan, you're a great guy and everything, but I don't like you in that way. I mean, there are some things that I would do with you, but my heart wouldn't be in it. What are you talking about? That you like me, and you want to be my boyfriend. You think I'm gay? Where did you get that? Uh, uh, you-you tried to kiss me. Peter, I'm not gay. What the hell's the matter with you? Look, look, look, let me let me put it to you this way. I'm attracted to you in the way that a man is attracted to a woman, but I'm not gay. When you live out in Hollywood, you learn that life is about different spirits and energies you meet along the way. I just thought maybe our spirits could intertwine, you know? Ouenergies could merge. Like my spirit could go up inside your energy. I- I have so much to learn about show business. But you know what? I could never really be attracted to somebody who uses labels like ""gay"" and ""straight."" Maybe you should just go. Well-Well, now, wait a second. What do you mean? This isn't working. It was a nice thought, but I think we should go our separate ways. No, Ryan. I get it now. I can be what you want. We could Peter. Don't embarrasyourself. You need to just let this go. Tickle fight! Tickle fight! No, Peter, no! Tickle fight! Tickle fight! Tickle fight Peter, no! No! Oh, my God It's time for you to leave. I can change. I can change. I'm sorry, Peter. We're done. We can never talk again. Here's a cell phone so we can always talk. Don't you guys have any tub toys? Here. Is rattle. This is prescription medication. And it's not even your name on the label. What What is this? What's in this tub? Is jicama. Jicama? And what is? What? What? This is a chicken leg. Are you also making soup? For quinceaÃ±era. Big party. Many peoples. Oh, my God. Hay un perro aqui. Â¿Doggy es aqui? I bet even you guys don't watch George Lopez. Consuela? Hey, it's Brian. I'm-I'm looking for Stewie. No, no baby aqui. I peed in your soup. Happy 15th birthday. Which, by the way, is not a special occasion in the normal world. Stewie, I've been worried sick. What the hell are you doing here? Brian? How did you find me? I used my nose, which I always forget about. Come on, let's go. No, I'm not going back! I can't! They're gonna be mad at me! I didn't tell anyone. You you didn't? No, I didn't. Look, I thought about it, and to be honest, it's probably my fault for leaving you alone in the car. And if you promise never to do it again, I won't say anything. Okay, I promise. My baby! What? I say, let go of me. Consuela, we're leaving. My baby! Hey, she says it's her baby, man. Now, get out of here. Is my baby. Ernesto. No, I'm not I'm not Ernest Okay, this is so messed up right now. I did not want to have to do that. They were very nice to me up until then. Peter, stop staring outhe window. Ryan's gone. He finished his movie, he's moved out. How could I have been so blind? How could I not have seen what he offered? I think the whole thing was very strange. He thought you were strange! How about that? Whatever. I just can't help but wonder will I ever see him again?"
S12e2,CHRIS:,"Ow! That's right. I do groceries. All right, even though we just walked in, and this whole place is one hallway, let's consult the map. Okay. Uh-oh. (gunshot) I'll bet we can find you some new clothes in here."
S12e2,PETER:,"Hey, Lois, are you sure this place is for men? Yes, Peter, it's for everyone. Really? 'Cause this-this kind of looks like a dress. Peter, it's fine. Come on out. Ha! You gaybo! Hang on, Peter. I'm gonna go look for a couple things for me in here. I'll be right back. Okay, Lois, I'll be right here, standing uncomfortably close to the unnecessary piano player in the middle of the mall.  So, what's it like now that you've made it? Did you ever have a bank account full of pedestrians' disinterested smiles? You're amazing. I'm gonna sit Indian-style on top of your piano. There aren't enough verses in any song I could write that would express how much hatred I have in my heart. You talk like a book. Hey, Lois, how about we try Sears? They got good stuff. Peter, nobody's been in Sears for decades. Oh, come on. When I was a boy, we always used to go clothes shopping at Sears. Trust me. They'll have everything I need. What the hell happened here? Look out! (muffled speaking) He wants to know who you are. We seek clothes for the cold times. (muffled speaking) He says he'll take you to the clothes for herbs and meat. Well, we can probably come up with some herbs and meat, right, Peter? Peter? I'm with them now. No girls allowed. (tires squealing) See, Lois, now, this is more like it. What the hell? Why won't this button? It's the same size I always get. Maybe you put on a few pounds, sweetie. Lois, I weigh the same that I weighed in grade school. Perhaps it's this lump on the side of your neck, sir. Oh, my God, Peter! How long have you had that thing? I-I don't know. We got to go see Dr. Hartman right away. Oh, my God, what if it's something serious? It's all right, it's all right. We'll be in good hands with Dr. Hartman. He handled my reassignment surgery. I think, emotionally, I've always been a lizard, you know? And now, I feel comfortable finally in my leathery, scaly skin. Kids, if you need me, I'll be on the wall making rapid, darting glances. Is this just to get out of my parents' visit? No. (doorbell rings)"
S12e2,BABS:,"Hello! No, you're stupid! Oh, hello, Griffins. What can I help you with today? Dr. Hartman, Peter has a huge lump growing on his neck. Mrs. Griffin, that's called a ""head."" I've been fooled by that one before. Well, will you take a look at it? I think it might be a tumor. Okay, let's have a look. Oh, yes, it appears that there is a Great rack, by the way. Thank you. Well, thank Grandma Griffin, really. It appears you have a subcutaneous vestigial twin growing on your neck. What is that? Well, it's an incomplete twin that never developed into a fully-formed person but still exists as a growth feeding off your body. Now, hold still. I'm just gonna give you a little topical anesthetic, and we'll have a closer look. (high-pitched voice): Hi, everybody! Aah! What the hell is that?! Oh, my God! It's a little me! Well, it looks as if he's more fully formed than we thought. Wow, your wife is gorgeous! Is that a foot? Almost! This is awesome! Finally, I'll have an interesting silhouette for the beginning of my spoken-word jazz. (stand-up bass plays slow jazz) I left my poem at home. MALE ANNOUNCER (over TV): We now return to Quantum Creep.  Al, what year is it? Cool. I'm gonna go show my penis to some kids. Hey, Dad. How'd it go at the hospital? Kids, remember how when you were little, you always wanted a neck uncle? No. Well, now you got one! (screaming) What is that thing?! This is my vestigial twin. I named him Chip. You know, like ""chip off the old neck."" I like to poke him 'cause it makes him happy, and I feel it a little bit in my nads. (both giggle) Well, keep that freakish thing under wraps. I don't want it cramping my style while I'm macking on toddlers. See you around, bitch. You know, Lois, a lot of times you go into someone's house, and it's just a house, but you can tell this is a home by all the love here. Aw! Aw! Aw! Aw! Peter, this seems unnatural, and, quite frankly, dangerous. Hey, you must be the owner of that Prius outside. Thanks for saving the world. He gets it. He gets what we Prius owners are trying to do. Wow, the world is such a cool place. There's so much I want to do and see! Oh, he's such a great energy to have around. Ah, Chip, I am gonna show you all kinds of cool stuff. My Hot Wheels, my lawn darts, even my new musket. (rapid, rhythmic whirring) Peter, what the hell are you doing? Lois, I thought I heard a noise downstairs. Go stall 'em for 20 minutes and pray that it's not too damp in here. (strums chord) Man, how do you know so many songs? Oh, when you're trapped under a layer of fat, a muffled folk song is like manna from Heaven. Give me a C. (strums chord)  Michael, row the boat ashore   Hallelujah"
S12e2,BOTH:,"Michael, row the boat ashore  Hallelujah Sister, help to trim the sail.  Sister, help to trim the sail   Hallelujah  Sister, help to trim (roaring) Aah! Run! No, Peter, gently stroke his snout counterclockwise. Wow, it's working. There's a universal language for all creatures, and it's called love. Now, how about that River Jordan?  River Jordan is deep and wide   Hallelujah Join us, bear!"
